{
  "shortName": "LoomSE Template Script",
  "longName": "",
  "author": "Franco Speziali",
  "description": "A sample script to demonstrate the capabilities of Loom",
  "firstScene": "shore",
  "scenes": {
    "shore": {
      "longName": "",
      "video": {
        "autoplay": true,
        "muted": true,
        "subtitles": "subtitles.srt",
        "sources": {
          "mp4": "assets/mp4/shore.mp4"
        }
      },
      "events": [
        {
          "pluginName": "showContentWithLogo",
          "in": 0,
          "out": 11,
          "payload": {
            "text": "Loom Story Engine"
          }
        },
        {
          "pluginName": "skipToScene",
          "in": 11,
          "out": 11,
          "payload": {
            "nextScene": "dolphins"
          }
        }
      ]
    },
    "dolphins": {
      "longName": "",
      "video": {
        "autoplay": true,
        "muted": true,
        "sources": {
          "mp4": "assets/mp4/dolphins.mp4"
        }
      },
      "events": [
        {
          "pluginName": "showContent",
          "in": 0.5,
          "out": 4,
          "payload": {
            "text": "This text is not part of the video file"
          }
        },
        {
          "pluginName": "showContent",
          "in": 4.5,
          "out": 9.5,
          "payload": {
            "text": "It is generated from an event"
          }
        },
        {
          "pluginName": "skipToScene",
          "in": 10,
          "out": 10,
          "payload": {
            "nextScene": "shore"
          }
        }
      ]
    }
  }
}
